The flow of quizzes is like a painted flower; it never wilts.
That memory we used to share slips on a banana peel.
A flailing monkey shakes beliefs widely held.
A glittering gem is often pregnant.
Style revels in authority.
That memory we used to share is interdependant on the relatedness of motivation, subcultures, and management.
A fly has your skin crawling.
Clear water bathes in sunlight.
Her daily goal was to improve on yesterday.
When I cook spaghetti, I like to boil it a few minutes past al dente so the noodles are super slippery.
She couldn't decide of the glass was half empty or half full so she drank it.
He ran out of money, so he had to stop playing poker.
He learned the important lesson that a picnic at the beach on a windy day is a bad idea.
With a single flip of the coin, his life changed forever.
There's an art to getting your way, and spitting olive pits across the table isn't it.
The Tsunami wave crashed against the raised houses and broke the pilings as if they were toothpicks.
It had been sixteen days since the zombies first attacked.
He wondered if she would appreciate his toenail collection.
Car safety systems have come a long way, but he was out to prove they could be outsmarted.
Plans for this weekend include turning wine into water.
He had unknowingly taken up sleepwalking as a nighttime hobby.
She cried diamonds.
Stop waiting for exceptional things to just happen.
The door slammed on the watermelon.
Tom got a small piece of pie.
It's difficult to understand the lengths he'd go to remain short.
The river stole the gods.
We have a lot of rain in June.
She advised him to come back at once.
You're unsure whether or not to trust him, but very thankful that you wore a turtle neck.
She was sad to hear that fireflies are facing extinction due to artificial light, habitat loss, and pesticides.
He dreamed of eating green apples with worms.
Twin 4-month-olds slept in the shade of the palm tree while the mother tanned in the sun.
Malls are great places to shop; I can find everything I need under one roof.
25 years later, she still regretted that specific moment.
The memory we used to share is no longer coherent.
Nobody has encountered an explosive daisy and lived to tell the tale.
He had reached the point where he was paranoid about being paranoid.
Joyce enjoyed eating pancakes with ketchup.
He picked up trash in his spare time to dump in his neighbor's yard.
It was a really good Monday for being a Saturday.
Art doesn't have to be intentional.
As he waited for the shower to warm, he noticed that he could hear water change temperature.
The bees decided to have a mutiny against their queen.
The swirled lollipop had issues with the pop rock candy.
He found the end of the rainbow and was surprised at what he found there.
Please tell me you don't work in a morgue.
The clouds formed beautiful animals in the sky that eventually created a tornado to wreak havoc.
A song can make or ruin a person’s day if they let it get to them.
When transplanting seedlings, candied teapots will make the task easier.
The delicious aroma from the kitchen was ruined by cigarette smoke.
In the end, he realized he could see sound and hear words.
Dan ate the clouds like cotton candy.
I currently have 4 windows open up… and I don’t know why.
The minute she landed she understood the reason this was a fly-over state.
He had accidentally hacked into his company's server.
He realized there had been several deaths on this road, but his concern rose when he saw the exact number.
They say that dogs are man's best friend, but this cat was setting out to sabotage that theory.
She wore green lipstick like a fashion icon.
This book is sure to liquefy your brain.
Sometimes, all you need to do is completely make an ass of yourself and laugh it off to realise that life isn’t so bad after all.
He poured rocks in the dungeon of his mind.
Don't piss in my garden and tell me you're trying to help my plants grow.
He learned the important lesson that a picnic at the beach on a windy day is a bad idea.
Malls are great places to shop; I can find everything I need under one roof.
As you consider all the possible ways to improve yourself and the world, you notice John Travolta seems fairly unhappy.
The random sentence generator generated a random sentence about a random sentence.
It was a slippery slope and he was willing to slide all the way to the deepest depths.
The fish listened intently to what the frogs had to say.
The doll spun around in circles in hopes of coming alive.
No matter how beautiful the sunset, it saddened her knowing she was one day older.
In that instant, everything changed.
He was 100% into fasting with her until he understood that meant he couldn't eat.
Truth in advertising and dinosaurs with skateboards have much in common.
Having no hair made him look even hairier.
The fact that there's a stairway to heaven and a highway to hell explains life well.
The newly planted trees were held up by wooden frames in hopes they could survive the next storm.
Joyce enjoyed eating pancakes with ketchup.
Courage and stupidity were all he had.
She could hear him in the shower singing with a joy she hoped he'd retain after she delivered the news.
Be careful with that butter knife.
The thick foliage and intertwined vines made the hike nearly impossible.
She let the balloon float up into the air with her hopes and dreams.
The efficiency we have at removing trash has made creating trash more acceptable.
He was sure the Devil created red sparkly glitter.
Writing a list of random sentences is harder than I initially thought it would be.
All they could see was the blue water surrounding their sailboat.
He picked up trash in his spare time to dump in his neighbor's yard.
She saw no irony asking me to change but wanting me to accept her for who she is.
The old apple revels in its authority.
It must be five o'clock somewhere.
Flying fish few by the space station.
He walked into the basement with the horror movie from the night before playing in his head.
8% of 25 is the same as 25% of 8 and one of them is much easier to do in your head.
Whenever he saw a red flag warning at the beach he grabbed his surfboard.
I’m a living furnace.
He wondered if it could be called a beach if there was no sand.
He told us a very exciting adventure story.
Iron pyrite is the most foolish of all minerals.
The tortoise jumped into the lake with dreams of becoming a sea turtle.
If eating three-egg omelets causes weight-gain, budgie eggs are a good substitute.
This is the last random sentence I will be writing and I am going to stop mid-sent
The memory we used to share is no longer coherent.
Stop waiting for exceptional things to just happen.
Peanuts don't grow on trees, but cashews do.
Behind the window was a reflection that only instilled fear.
My dentist tells me that chewing bricks is very bad for your teeth.
Let me help you with your baggage.
